{
  "schema_version": "abc/parser-rq-source-accountability-aggregate/v1",
  "identity_ref": "sha256:aaaaaaaaaaaaaaaaaaaaaaaaaaaaaaaaaaaaaaaaaaaaaaaaaaaaaaaaaaaaaaaa",
  "taxonomy_version": "parser-rq-ignored-regions-v1",
  "taxonomy_hash": "sha256:bbbbbbbbbbbbbbbbbbbbbbbbbbbbbbbbbbbbbbbbbbbbbbbbbbbbbbbbbbbbbbbb",
  "coordinate_system": "decoded_utf8",
  "status": "ok",
  "work_completeness": {"expected": 1, "observed": 1, "complete": true},
  "eligible_bytes": 3,
  "covered_eligible_bytes": 2,
  "uncovered_eligible_bytes": 1,
  "uncovered": [{"work_id": "w1", "start": 2, "end": 3}]
}
